<?xml version="1.0" encoding="ISO-8859-1" ?>

<!-- Sample Overlay Example -->
<metadata
        xmlns="https://draagon.com/schema/metamodel/produce/v1"
        xmlns:xsi="http://www.w3.org/2001/XMLSchema-instance"
        xsi:schemaLocation="https://draagon.com/schema/metamodel/produce/v1 produce-v1-model.xsd"
        package="produce::v1">

    <!-- Custom Extension -->
    <object package="::container::ext" name="ProduceExt" isEmbedded="true">

        <!-- Name -->
        <field name="name" super="..::..::common::name"/>

        <!-- Foo Double -->
        <field name="foo" subType="double"/>

    </object>

    <!-- Overlay just for Apple -->
    <object package="::fruit" name="Apple">

        <!-- Special Overlay -->
        <field name="specialOverlay" subType="string"/>

    </object>

    <!-- Overlay for a container -->
    <object package="::container" name="Basket">

        <!-- Special Overlay -->
        <field name="specialOverlay" subType="string"/>

        <!-- Special Extension -->
        <field name="specialExt" subType="object" objectRef="::ext::ProduceExt"/>

    </object>

</metadata>
